{
  "mode": "standard",
  "edition": "Standard",
  "title": "Standard MURDLE — Vault Breach",
  "subtitle": "Standard mode: 5 suspects, 5 weapons, 5 locations",
  "storyTitle": "The Stolen Solution Design",
  "storyHtml": "<p>A confidential solution design disappeared from the Dynavics Solution Vault. The access log identifies five possible suspects and five unusual items.</p><p><span class=\"small\">Determine the suspect, item, and location connected to the breach.</span></p>",
  "clues": [
    {
      "text": "Zara was in the Solution Vault."
    },
    {
      "text": "The Passcode was used in the Solution Vault."
    },
    {
      "text": "Milo carried the Headset in the AI Studio."
    },
    {
      "text": "Erin worked in the Project Room."
    },
    {
      "text": "The Notebook was in the Project Room."
    },
    {
      "text": "Dani carried the Tablet."
    },
    {
      "text": "The Tablet was in the Demo Suite."
    },
    {
      "text": "Omar carried the USB Key."
    },
    {
      "text": "The USB Key was not in the Support Hub."
    },
    {
      "text": "The Scanner was found in the Support Hub."
    }
  ],
  "suspects": [
    "Zara",
    "Milo",
    "Erin",
    "Dani",
    "Omar"
  ],
  "weapons": [
    "Passcode",
    "Headset",
    "Notebook",
    "Tablet",
    "USB Key"
  ],
  "rooms": [
    "Solution Vault",
    "AI Studio",
    "Project Room",
    "Demo Suite",
    "Support Hub"
  ],
  "solution": {
    "suspect": "Zara",
    "weapon": "Passcode",
    "room": "Solution Vault"
  }
}
