{
  "mode": "mini",
  "edition": "Mini",
  "title": "Mini MURDLE — The Missing Extension",
  "subtitle": "Mini mode: 3 suspects, 3 weapons, 3 locations",
  "storyTitle": "Mystery at the App Lab",
  "storyHtml": "<p>A valuable Business Central extension vanished before its release. One Dynavics specialist used an everyday office item to hide the evidence somewhere in the App Lab.</p>",
  "clues": [
    {
      "text": "Ava was working in the Demo Suite, not the App Lab."
    },
    {
      "text": "The person in the App Lab used the USB Key."
    },
    {
      "text": "Ben had the Notebook."
    },
    {
      "text": "Cora was not in the Project Room."
    },
    {
      "text": "The Tablet was found in the Project Room."
    }
  ],
  "suspects": [
    "Ava",
    "Ben",
    "Cora"
  ],
  "weapons": [
    "USB Key",
    "Notebook",
    "Tablet"
  ],
  "rooms": [
    "App Lab",
    "Demo Suite",
    "Project Room"
  ],
  "solution": {
    "suspect": "Cora",
    "weapon": "USB Key",
    "room": "App Lab"
  }
}
