{
  "mode": "mini",
  "edition": "Mini",
  "title": "Mini MURDLE — The Silent Agent",
  "subtitle": "Mini mode: 3 suspects, 3 weapons, 3 locations",
  "storyTitle": "Trouble in the Solution Vault",
  "storyHtml": "<p>A helpful AI agent suddenly stopped responding. The audit trail points to one consultant, one device, and one Dynavics workspace.</p>",
  "clues": [
    {
      "text": "Iris was in the Solution Vault."
    },
    {
      "text": "The Token was used in the Solution Vault."
    },
    {
      "text": "Liam carried the Headset."
    },
    {
      "text": "The Tablet was in the AI Studio."
    },
    {
      "text": "Jade was not in the Support Hub."
    }
  ],
  "suspects": [
    "Iris",
    "Jade",
    "Liam"
  ],
  "weapons": [
    "Token",
    "Tablet",
    "Headset"
  ],
  "rooms": [
    "Solution Vault",
    "AI Studio",
    "Support Hub"
  ],
  "solution": {
    "suspect": "Iris",
    "weapon": "Token",
    "room": "Solution Vault"
  }
}
