{
  "mode": "mini",
  "edition": "Mini",
  "title": "Mini MURDLE — Checkout Chaos",
  "subtitle": "Mini mode: 3 suspects, 3 weapons, 3 locations",
  "storyTitle": "The Broken Basket",
  "storyHtml": "<p>The demonstration shop failed moments before a customer presentation. Someone sabotaged the checkout using a suspicious piece of equipment.</p>",
  "clues": [
    {
      "text": "Noah was in the Workshop."
    },
    {
      "text": "The Cable was used in the Workshop."
    },
    {
      "text": "Mia carried the Scanner."
    },
    {
      "text": "The Laptop was not in the Boardroom."
    },
    {
      "text": "Owen was not in the Demo Shop."
    }
  ],
  "suspects": [
    "Mia",
    "Noah",
    "Owen"
  ],
  "weapons": [
    "Scanner",
    "Cable",
    "Laptop"
  ],
  "rooms": [
    "Demo Shop",
    "Workshop",
    "Boardroom"
  ],
  "solution": {
    "suspect": "Noah",
    "weapon": "Cable",
    "room": "Workshop"
  }
}
